{
  "user_id": "demo_user",
  "total_income_usd": 18500.0,
  "total_outflow_usd": 13227.5,
  "savings_rate": 0.285,
  "reserve_months": 8.2,
  "category_breakdown": [
    {
      "category": "housing",
      "amount_usd": 4200.0,
      "percent_of_total": 31.8,
      "monthly_average_usd": 4200.0
    },
    {
      "category": "dining",
      "amount_usd": 2150.0,
      "percent_of_total": 16.3,
      "monthly_average_usd": 1350.0
    },
    {
      "category": "groceries",
      "amount_usd": 1680.0,
      "percent_of_total": 12.7,
      "monthly_average_usd": 1600.0
    },
    {
      "category": "transportation",
      "amount_usd": 1240.0,
      "percent_of_total": 9.4,
      "monthly_average_usd": 1200.0
    },
    {
      "category": "utilities",
      "amount_usd": 620.0,
      "percent_of_total": 4.7,
      "monthly_average_usd": 600.0
    },
    {
      "category": "other",
      "amount_usd": 3337.5,
      "percent_of_total": 25.1,
      "monthly_average_usd": 3200.0
    }
  ],
  "anomalies": [
    {
      "category": "dining",
      "amount_usd": 2150.0,
      "trailing_average_usd": 1350.0,
      "description": "Dining spend jumped 59% above trailing 3-month average ($1,350/mo)",
      "date": "2026-08-01"
    }
  ],
  "narrative_summary": "Spending is well-controlled with a healthy 28.5% savings rate and 8.2 months of cash liquidity. However, dining expenditures exceeded trailing averages by $800 this month."
}
